### ISSUE TITLE
piping with tcp reuse-raw splits payload

### ISSUE THREAD

**Issue by philipprimli** [vi/websocat#169]
let's assume test_message.txt defined as
74 65 73 74 0a 20
--> so payload is 6 bytes

1st Terminal: websocat -u  -t tcp-l:127.0.0.1:1234 reuse-raw:- | websocat -v -n --ping-interval 3  --ws-c-uri=wss://ws.postman-echo.com/raw  --no-line --protocol 'v11.stomp'   - ws-c:cmd:'openssl s_client -connect ws.postman-echo.com:443 -quiet -keylogfile key_log.txt'
2nd Terminal: cat test_message.txt | nc -q 1 127.0.0.1 1234

capturing with tcpdump reveals payload being splitted into 2 parts:

Frame 257: 108 bytes on wire (864 bits), 108 bytes captured (864 bits)
Linux cooked capture v1
Internet Protocol Version 4, Src: 192.168.128.12, Dst: 52.7.229.150
Transmission Control Protocol, Src Port: 32958, Dst Port: 443, Seq: 861, Ack: 6020, Len: 40
Transport Layer Security
WebSocket
    1... .... = Fin: True
    .000 .... = Reserved: 0x0
    .... 0001 = Opcode: Text (1)
    1... .... = Mask: True
    .000 0101 = Payload length: 5
    Masking-Key: c381ba5a
    Masked payload
    Payload
Line-based text data (1 lines)
    test\n

Payload in HEX: 74 65 73 74 0a

Frame 261: 104 bytes on wire (832 bits), 104 bytes captured (832 bits)
Linux cooked capture v1
Internet Protocol Version 4, Src: 192.168.128.12, Dst: 52.7.229.150
Transmission Control Protocol, Src Port: 32958, Dst Port: 443, Seq: 901, Ack: 6056, Len: 36
Transport Layer Security
WebSocket
    1... .... = Fin: True
    .000 .... = Reserved: 0x0
    .... 0001 = Opcode: Text (1)
    1... .... = Mask: True
    .000 0001 = Payload length: 1
    Masking-Key: 1ff85fe5
    Masked payload
    Payload
Line-based text data (1 lines)
    \000

Payload in HEX: 00

Whereas piping the file directly to websocat would transmit the payload correctly:
cat test_message.txt | websocat -v -n --ping-interval 3  --ws-c-uri=wss://ws.postman-echo.com/raw  --no-line --protocol 'v11.stomp'   - ws-c:cmd:'openssl s_client -connect ws.postman-echo.com:443 -quiet -keylogfile key_log.txt'

Frame 2192: 109 bytes on wire (872 bits), 109 bytes captured (872 bits)
Linux cooked capture v1
Internet Protocol Version 4, Src: 192.168.128.12, Dst: 3.218.100.165
Transmission Control Protocol, Src Port: 58000, Dst Port: 443, Seq: 673, Ack: 5848, Len: 41
Transport Layer Security
WebSocket
    1... .... = Fin: True
    .000 .... = Reserved: 0x0
    .... 0001 = Opcode: Text (1)
    1... .... = Mask: True
    .000 0110 = Payload length: 6
    Masking-Key: 2080be21
    Masked payload
    Payload
Line-based text data (2 lines)
    test\n
    \000

Payload in HEX: 74 65 73 74 0a 00

**Comment by philipprimli** [comment]
ok, thanks. Your suggestion worked fine with me using a base64-encoded approach.
